{
  "$schema": "https://json-schema.org/draft/2020-12/schema",
  "$id": "https://github.com/sbox-cool/sbox-network-storage-server/blob/main/compat/library-matrix.schema.json",
  "title": "Network Storage library compatibility matrix",
  "description": "Which library builds this server supports, and the evidence that each pairing was tested. Embedded in the server binary; read by /v3/server-info (compat) and by scripts/compat-tested-with.ps1.",
  "type": "object",
  "additionalProperties": false,
  "required": ["schemaVersion", "minimum", "recommended", "libraries", "deprecated", "blocked", "tested"],
  "properties": {
    "$schema": { "type": "string" },
    "schemaVersion": { "const": 1 },
    "minimum": {
      "$ref": "#/$defs/semver",
      "description": "Lowest supported library version. Anything below it is 'unsupported'. Moving it needs 90 days at 'deprecated' and a minor server bump (docs/releasing.md)."
    },
    "recommended": {
      "$ref": "#/$defs/semver",
      "description": "Library version that is current. Anything below it (and at or above minimum) is 'outdated'."
    },
    "libraries": {
      "type": "array",
      "description": "Known library builds. 'legacy' is the bucket for every build that sends no version header.",
      "items": { "$ref": "#/$defs/library" }
    },
    "deprecated": {
      "type": "array",
      "description": "Version ranges whose support ends on the sunset date.",
      "items": {
        "type": "object",
        "additionalProperties": false,
        "required": ["range", "sunset"],
        "properties": {
          "range": { "$ref": "#/$defs/range" },
          "sunset": { "$ref": "#/$defs/date" },
          "reason": { "type": "string" }
        }
      }
    },
    "blocked": {
      "type": "array",
      "description": "Version ranges with a security or data-loss problem. Reserved for those; the only immediate path to a refusal.",
      "items": {
        "type": "object",
        "additionalProperties": false,
        "required": ["range", "reason"],
        "properties": {
          "range": { "$ref": "#/$defs/range" },
          "reason": { "type": "string", "minLength": 1 },
          "advisory": { "type": "string" }
        }
      }
    },
    "tested": {
      "type": "array",
      "description": "One row per test run: which library, on which engine build, was tested with which server, and where the proof is. Compat engine runs (ci-only) and native editor runs (pass) write these rows (docs/editor-test-plan.md).",
      "items": { "$ref": "#/$defs/tested" }
    }
  },
  "$defs": {
    "semver": {
      "type": "string",
      "pattern": "^(0|[1-9][0-9]*)\\.(0|[1-9][0-9]*)\\.(0|[1-9][0-9]*)(-[0-9A-Za-z-]+(\\.[0-9A-Za-z-]+)*)?$"
    },
    "range": {
      "type": "string",
      "description": "Space-separated comparators (<, <=, >, >=, =, or a bare exact version), all of which must hold: '1.2.1', '<1.2.0', '>=1.1.0 <1.3.0'. Extra spaces are tolerated, as in VersionRange.TryParse.",
      "pattern": "^(([<>]=?|=)?(0|[1-9][0-9]*)\\.(0|[1-9][0-9]*)\\.(0|[1-9][0-9]*)(-[0-9A-Za-z-]+(\\.[0-9A-Za-z-]+)*)?)( +(([<>]=?|=)?(0|[1-9][0-9]*)\\.(0|[1-9][0-9]*)\\.(0|[1-9][0-9]*)(-[0-9A-Za-z-]+(\\.[0-9A-Za-z-]+)*)?))*$"
    },
    "date": {
      "type": "string",
      "pattern": "^[0-9]{4}-(0[1-9]|1[0-2])-(0[1-9]|[12][0-9]|3[01])$"
    },
    "engine": {
      "type": "string",
      "description": "s&box engine build string, e.g. 26.10.02.",
      "pattern": "^[0-9]+(\\.[0-9]+)*$"
    },
    "engineRange": {
      "type": "string",
      "description": "Engine build comparators, e.g. '>=26.10'. Extra spaces are tolerated, as in VersionRange.TryParse.",
      "pattern": "^([<>]=?|=)?[0-9]+(\\.[0-9]+)*( +([<>]=?|=)?[0-9]+(\\.[0-9]+)*)*$"
    },
    "library": {
      "type": "object",
      "additionalProperties": false,
      "required": ["version", "status"],
      "properties": {
        "version": {
          "description": "SemVer, or 'legacy'.",
          "anyOf": [{ "$ref": "#/$defs/semver" }, { "const": "legacy" }]
        },
        "revision": { "type": "integer", "minimum": 0, "description": "s&box package revision (the <revision> of .version 1.0.<revision>); assigned by sbox.game at publish, so recorded after it." },
        "revisions": { "type": "string", "pattern": "^([<>]=?|=)?[0-9]+( +([<>]=?|=)?[0-9]+)*$", "description": "Revision range for a bucket, e.g. '<=309133'. Extra spaces are tolerated, as in VersionRange.TryParse." },
        "released": { "$ref": "#/$defs/date" },
        "minServer": { "$ref": "#/$defs/semver", "description": "Oldest server version this library works with." },
        "status": { "enum": ["supported", "deprecated", "unsupported", "known-broken"] },
        "sunset": { "$ref": "#/$defs/date", "description": "Required when status is 'deprecated'." },
        "announced": { "$ref": "#/$defs/date", "description": "Optional: when the deprecation was published. When present, the release gate requires sunset to be at least 90 days later (docs/compatibility.md)." },
        "engine": { "$ref": "#/$defs/engineRange", "description": "For 'known-broken': the engine builds it breaks on." },
        "reason": { "type": "string" },
        "issue": { "type": "string" },
        "notes": { "type": "string" }
      },
      "allOf": [
        { "if": { "properties": { "status": { "const": "deprecated" } }, "required": ["status"] }, "then": { "required": ["sunset"] } },
        { "if": { "properties": { "status": { "const": "known-broken" } }, "required": ["status"] }, "then": { "required": ["reason"] } }
      ]
    },
    "tested": {
      "type": "object",
      "additionalProperties": false,
      "required": ["server", "library", "database", "result", "evidence"],
      "properties": {
        "server": { "$ref": "#/$defs/semver", "description": "Server build tested (/v3/server-info version)." },
        "commit": { "type": "string", "pattern": "^[0-9a-f]{7,40}$", "description": "Server commit the run used, for release-commit matching." },
        "kind": { "enum": ["self-hosted", "hosted"], "description": "Which backend answered (/v3/server-info kind)." },
        "library": { "$ref": "#/$defs/semver", "description": "Library version tested (LibraryVersion, or the git tag for a git checkout)." },
        "librarySource": { "type": "string", "description": "git:<sha>, library-manager, or release:<tag>." },
        "revision": { "type": "integer", "minimum": 0, "description": "s&box package revision of the library, when known." },
        "engine": { "$ref": "#/$defs/engine", "description": "Full s&box engine build string from the editor, e.g. 26.10.02." },
        "os": { "type": "string", "minLength": 1, "description": "Operating system the editor or game ran on, e.g. 'Windows 11 23H2'." },
        "database": {
          "type": "array",
          "minItems": 1,
          "uniqueItems": true,
          "items": { "enum": ["sqlite", "postgres"] }
        },
        "result": { "enum": ["pass", "fail", "ci-only"], "description": "'ci-only' is a green Compat engine run with no native s&box editor run; the release notes call it out. 'pass' is a native editor run." },
        "date": { "$ref": "#/$defs/date" },
        "evidence": {
          "type": "array",
          "minItems": 1,
          "items": { "type": "string", "minLength": 1, "description": "Issue or PR reference (owner/repo#N) or a URL." }
        },
        "notes": { "type": "string" }
      },
      "allOf": [
        {
          "description": "A 'pass' is a native s&box editor run, and a run without its engine build, OS and backend kind is not evidence (docs/editor-test-plan.md). Use 'ci-only' for a green Compat engine run with no native editor run.",
          "if": { "properties": { "result": { "const": "pass" } }, "required": ["result"] },
          "then": { "required": ["engine", "os", "kind", "librarySource"] }
        }
      ]
    }
  }
}
